consensus text,line number,line slope,consensus score,line edited (T/F),original transcriber username,line editor username,flagged for low consensus (T/F),page number,column,number of transcribers,line start x,line end x,line start y,line end y
275,1,-3.504000000000019,3,false,"","",false,1,1,3,812.3370356138552,861.4064123760038,195.02602218173843,192.02174032190584
Human life is nothing more than a succession,2,179.325,3,false,"","",false,1,1,3,903.6224021709328,136.53691910462817,1175.0377670474204,1188.0562199039466
"of sensations, ideas pleasures & pains -",3,179.325,3.857142857142857,false,"","",false,1,1,4,840.5331325319703,169.58363755247956,1145.9967131781432,1153.0066214155195
Science or knowledge is the association of a,4,179.325,3.875,false,"","",false,1,1,4,843.5373761907722,127.52414992719173,1098.930101853478,1111.9485165089734
x number of ideas with some idea or term,5,179.325,3,false,"","",false,1,1,3,871.5770473413077,113.50429525140862,1059.8748196859613,1077.9003580408341
capable of recalling them to the mind in a certain,6,179.325,3,false,"","",false,1,1,3,831.5203633545339,132.5312354255384,1019.8181356991876,1029.832306695881
x order. - . Since we are conscious by looking,7,179.325,3.9,false,"","",false,1,1,4,870.5756455220505,144.548210060746,991.7784645486521,1001.7926355453455
back & viewing the ocean. -,8,179.325,3,false,"","",false,1,1,3,864.5671200034161,360.8542883089118,951.7217805618784,965.7416352376615
"[Ink sketch of face in profile, outline and hair only, no facial features included]",9,179.325,3,false,"","",false,1,1,3,577.1604047581084,351.84159553353686,829.5488867620124,822.5389976251515
